标题,发布时间,品种,内容
甘肃省定西市陇西县党参走势稳定,2025-12-25 10:57,党参,"【天地网讯】

今日行情，甘肃省定西市陇西县党参（药厂个子）价格为38元/公斤，（456个子）价格为43元/公斤，（散条个子）价格为36元/公斤，（0.3薄片）价格为60元/公斤，（0.3厚片）价格为52元/公斤，（0.4厚片）价格为65元/公斤，走势稳定，货源充足。"
甘肃省定西市陇西县黄芪走势稳定,2025-12-25 10:54,黄芪,"【天地网讯】

今日行情，甘肃省定西市陇西县黄芪（药厂个子）价格为10.5元/公斤，（毛二条）价格为8元/公斤，（0.3瓜子片）价格为13元/公斤，（812过色选）价格为32元/公斤，（5-8丁过色选）价格为13元/公斤，（3-5丁）价格为8元/公斤，走势稳定，货源充足。"
山东省临沂市平邑县 金银花 近日行情稳定,2025-12-25 10:50,金银花,"【天地网讯】

今日行情，山东省临沂市平邑县，金银花（青花饮片）价格为110元，（黄白花一级）价格为85元，（黄白花二级）价格为77元，（三级药厂投料货）价格为68元，（四级投料货）价格为60元，（饮料货）价格为50元，走势稳定，货源充足。"
甘肃省陇西首阳市场甘草走动加快,2025-12-25 09:18,甘草,"【天地网讯】

甘肃省陇西首阳市场甘草走动加快，今年产新高含量货不多，市场寻货商家不多，以够含量为主，12-18的为主，3-5丁走动平稳，价格平稳，0.3-0.5筛价格在6-8元之间，0.5-0.8筛价格在10-14元之间，0.8-1.2筛价格在22-27元之间，1.2-1.6筛价格在24-30元之间。（本信息由甘肃福草农业:张阳18309377666提供）"
山东省潍坊市临朐县丹参走动平稳,2025-12-25 09:11,丹参,"【天地网讯】

山东省潍坊市临朐县丹参走动平稳，行情稳定，产地货源充足，药厂货价格在9元左右，条子货价格在15元左右。（本信息由山东省潍坊市临朐县袁小园15256199121提供）"
安徽省阜阳市阜南县白术库存充足,2025-12-24 23:40,白术,"【天地网讯】

今日行情，安徽省阜阳市阜南县白术行情暂时平稳，现安徽省阜阳市市场与集镇周边一年干货白术要价在10-13元之间，两年的白术报价在20-25元之间，其IE药农手中一年，二年，干货库存充足。（信息来源于产地商家森林药业18856853555）"
安徽省阜阳市阜南县金银花价格稳定,2025-12-24 23:35,金银花,"【天地网讯】

安徽省阜阳市阜南县金银花产地，金银花库存充足，价格稳定，交易量稳定，价格在100元/公斤上下浮动，药农出货热情低。（信息来源于产地商家森林药业18856853555）"
安徽省阜阳市夏天无价格稳步上升,2025-12-24 23:31,夏天无,"【天地网讯】

今日行情，安徽省阜阳市阜南县，夏天无（统货）价格为50元/公斤，走势稳定，货源不丰。
夏天无今年因为减产原因，上市量不丰。价格稳步上升，交易量稳定。药农看到了希望。（信息来源于产地商家森林药业18856853555）"
甘肃省定西市岷县黄芪价格稳定,2025-12-24 21:42,黄芪,"【天地网讯】

今日行情，甘肃省定西市岷县黄芪今天市场上货量77吨。成交量14%，市场人流量较前几日有所增加，有少量外地客商采购0.8-1.0和1.2-1.4瓜子片，本地采购商采购0.6-0.8的，成交价格稳定，今日成交价格0.4-0.6瓜子片13-17元之间不等，0.6-8瓜子片19-25元之间不等，0.8-1.0瓜子片26-37元之间不等，1.0-1.2瓜子片39-50元之间不等，1.2-1.4瓜子片51-60元之间不等，1.4-1.8瓜子片61-72元之间不等，精选片价格高10元每公斤。（此资讯由甘肃岷县岷芪源提供18293255658）"
甘肃省定西市岷县党参成交价格坚挺,2025-12-24 21:35,党参,"【天地网讯】

今日行情，甘肃省定西市岷县党参今天市场上货量150吨，成交量27%，市场人流量大，走货快，成交价格坚挺，有外地客商采购中条和切片货，本地采购商多以中条和大条为主，采购力度大，成交货源多，今日成交价格小条（药厂）36-43元之间不等，小条44-52元之间不等，中条57-78元之间不等，大条81-102元之间不等，特大条106元以上，市场货多以7-9成干为主，干度好的货价格高5-10元每公斤。（此资讯由甘肃岷县岷芪源提供18293255658）"
甘肃省定西市岷县当归价格基本稳定,2025-12-24 21:30,当归,"【天地网讯】

今日行情，甘肃省定西市岷县当归今天市场上货量73吨，市场人流量大，有外地客商采购中条和大条，本地采购商多以切片货为主，成交价格基本稳定，今日成交价格小条（药厂）31-37元之间不等，小条38-45元之间不等，中条48-57元之间不等，大条58-64元之间不等，特大条65元以上。（此资讯由甘肃岷县岷芪源提供18293255658）"
甘肃省定西市岷县当归成交价格稳定,2025-12-24 20:28,当归,"【天地网讯】

今日行情，甘肃省定西市岷县今日当归上货量大，货源充足，人流量大，人气回暖，成交价格稳定，目前药厂货成交价28-30元，小条成交价30-35元，中条成交40-45元，大条成交50元以上不等。"
甘肃省定西市岷县黄芪走动平稳,2025-12-24 20:24,黄芪,"【天地网讯】

今日行情，甘肃省定西市岷县黄芪今日党参上货量大，货源充足，市场人流量大，走动平稳，成交量稳定，价格坚挺，目前药厂货成交价33-36元之间不等，小条成交价40-45元之间不等，中条成交价50-60元之间不等，大条成交70-80元之间不等，特大100-110元之间不等。"
河南省信阳市商城县猫爪草价格基本稳定,2025-12-24 17:01,猫爪草,"【天地网讯】

河南省信阳市商城县猫爪草最近走动不快，但价格基本稳定，现产地统货售价在35元上下，水洗货报价在40元左右，供应有量。（本信息由河南省信阳市商城县商家周先生13137622610提供）"
河南省信阳市商城县夏天无行情明显回升,2025-12-24 17:00,夏天无,"【天地网讯】

河南省信阳市商城县夏天无由于有商视价低购进并看好囤货，导致货源交易出现好转，行情明显回升，现产地统货售价在40元左右。（本信息由河南省信阳市商城县商家周先生13137622610提供）"
河南省信阳市商城县野菊花行情平稳,2025-12-24 16:59,野菊花,"【天地网讯】

河南省信阳市商城县野菊花随着阳历年的到来，用药单位少有购货，目前走动显缓，但行情平稳，现产地90颗粒高含量的价格在35-36元，低含量的报价在32-33元。（本信息由河南省信阳市商城县商家周先生13137622610提供）"
河南省信阳市商城县水菖蒲走动不快,2025-12-24 16:58,水菖蒲,"【天地网讯】

河南省信阳市商城县水菖蒲虽有货供应，但货源实际走动不快，行情保持稳定，目前产地水菖蒲统货要价9元左右。（本信息由河南省信阳市商城县商家周先生13137622610提供）"
河南省信阳市商城县铁莲子处于平缓走动,2025-12-24 16:57,莲子,"【天地网讯】

河南省信阳市商城县铁莲子供应有量，最近处于平缓走动，价格与前阶段基本持平，目前产地售价在17元左右。（本信息由河南省信阳市商城县商家周先生13137622610提供）"
河南省信阳市商城县女贞子价格还是稳定,2025-12-24 16:56,女贞子,"【天地网讯】

河南省信阳市商城县女贞子受价低影响，近日有商抢收，且货源整体交易尚可，但价格还是稳定，目前产地统货要价在1.6元左右。（本信息由河南省信阳市商城县商家周先生13137622610提供）"
浙江省磐安县今日逢集，浙贝母行情暂稳,2025-12-24 13:54,浙贝母,"【天地网讯】

浙江省金华市磐安县今日逢集，浙贝母货源上市量大一般，农户手中货源不丰，一般小统货收购价160元每公斤，农户对未来行情持续看好，行情暂时稳定，主流货成交价162元每公斤，后市持续向好，后续持续关注。（信息由浙江省金华市磐安县商家周先生18858942548提供）"
浙江磐安浙八味市场覆盆子走动平稳,2025-12-24 13:53,覆盆子,"【天地网讯】

浙江磐安浙八味市场覆盆子交易日，今日市场整体交易氛围平稳，货源走动以正常需求为主，主流成交价在80元/公斤 左右，符合药典标准、可提供全项检验报告的优质覆盆子，报价维持在110元/公斤左右。（本快讯由浙江四云堂药业有限公司提供18267994685）"
甘肃岷县 当归新货零星上市价格低迷,2025-12-24 13:53,当归,"【天地网讯】

今日，岷县中国当归城市场：当归新货零星上市，干度多为七八成干，新旧货比例1：9成，交易在低谷期平稳运行，药厂货31元/公斤左右，小条38元/公斤左右，中条45元/公斤左右，大条52元/公斤左右，特大条60元/公斤左右；当归头片95一200元/公斤，全归片45一58元/公斤，枯子片64元/公斤左右，箱归半成品多在60一78元/公斤之间徘徊，黄货62一83元/公斤，佛手片（芯片）68一86元/公斤，采购者多以本地加工户为主，外地采购商较少。（此信息由西岭源合作社18219820026<微信同号>提供）。"
浙江磐安“浙八味”药材市场浙贝母交易日行情信息,2025-12-24 13:52,浙贝母,"【天地网讯】

日期： 2025年12月24日（星期三）今日市场交易氛围持续活跃，整体货源走动顺畅。浙贝母作为磐安道地药材的代表品种之一，行情表现坚挺，市场关注度集中。主流成交价： 行情主流成交价格依旧稳定在 160元/公斤 左右。无硫好的统货个子，市场主流报价在 95元/公斤 左右。 该价位已延续一段时间，反映出供需双方对当前价格的认可，市场交易以实销为主。本快讯由（浙江四云堂药业有限公司提供18267994685）"
云南省玉溪市江川县龙胆草苗正在加工之中,2025-12-24 13:32,龙胆,"【天地网讯】

云南省玉溪市江川县龙胆草苗加工户一般年前加工年后出售，目前加工工作正在进行，今年的价格偏低，统货在6-7元之间。（信息由云南省玉溪市江川县商家陆先生13887723718提供）"
云南省玉溪市江川县余甘子肉货源不多,2025-12-24 13:25,余甘子,"【天地网讯】

云南省玉溪市江川县余甘子肉目前货源不多，近期走动一般，行情稳定运行，现统货价格在11元上下。（信息由云南省玉溪市江川县商家陆先生13887723718提供）"
湖北省黄冈市蕲春县水栀子行情一般,2025-12-24 13:24,水栀,"【天地网讯】

湖北省黄冈市蕲春县水栀子近期货源走动不是很快，产地货源有量，近期行情表现一般，现统货价格在26元左右，该品前两年大量种植，去年和今年的挂果率还不高，明年开始则会继续增多。（信息由湖北省黄冈市蕲春县商家邓老板提供）"
湖北省黄冈市蕲春县栀子货源不多,2025-12-24 13:23,栀子,"【天地网讯】

湖北省黄冈市蕲春县栀子野生家种均有，今年的产量比去年稍多，现产地货量不大，近期价格稳定，现野生后期货在21元左右，当地距离江西不远，江西货在23-24元之间。（信息由湖北省黄冈市蕲春县商家邓老板提供）"
浙江省金华市磐安县浙八味市场浙贝母交易仍旺,2025-12-24 11:47,浙贝母,"【天地网讯】

浙江省金华市磐安县浙八味市场今天逢集，货源上市量依然较大，商家继续收购，交易良好，行情依然较旺，中统片价格继续稳定在80元左右。（信息由浙江省金华市磐安县商家陈先生提供）"
浙江省金华市磐安县浙八味市场覆盆子行情平淡,2025-12-24 11:46,覆盆子,"【天地网讯】

浙江省金华市磐安县浙八味市场覆盆子货源供应有量，但是近期商家的采购积极性依然一般，行情继续平淡运行，现统货价格在80元左右，选货90元。（信息由浙江省金华市磐安县商家陈先生提供）"
浙江省金华市磐安县延胡索行情由升转稳,2025-12-24 11:46,延胡索,"【天地网讯】

浙江省金华市磐安县延胡索前段时间行情上涨，今天当地交易市场逢集，行情由升转稳，目前本地统个价格在60-62元之间，选货68元上下。（信息由浙江省金华市磐安县商家陈先生提供）"
山东省济宁市汶上县酸枣仁要价坚挺,2025-12-24 11:41,酸枣仁,"【天地网讯】

山东省济宁市汶上县酸枣仁受加工成本支撑以及价涨影响，加工户与产地商贩暂表露惜售心理，要价坚挺，现产地98饮片货售价在295元左右，95货售价在270-280元之间不等。（本信息由山东省济宁市汶上县商家李如义13853733519提供）"
山东省济宁市汶上县柏子仁行情平稳,2025-12-24 11:38,柏子仁,"【天地网讯】

山东省济宁市汶上县柏子仁近两日一般为商家按计划购进，行情平稳运行，目前产地合格货售价在110元左右，一般货报价维持在90-100元之间不等。（本信息由山东省济宁市汶上县商家李如义13853733519提供）"
山东省济宁市汶上县芡实处于平缓走动,2025-12-24 11:37,芡实,"【天地网讯】

山东省济宁市汶上县芡实近两日行情依然比较稳定，货源处于平缓走动，现产地两瓣10厘货价格在25元左右，四六瓣货报价在16-18元之间不等，其该品还在持续产新。（本信息由山东省济宁市汶上县商家李如义13853733519提供）"
湖南省湘西龙山县百合价格再次升高,2025-12-24 11:36,百合,"【天地网讯】

湖南省湘西龙山县百合虽然价格再次升高，但近日走动并不快，目前产地干百合统货售价在90-95之间不等，选货售价在100-110元之间不等。（本信息由湖南龙山县翟孝龙18692583272提供）"
四川省成都市彭州市敖平镇川芎快讯信息,2025-12-24 11:21,川芎,"【天地网讯】

今日行情,四川省成都市彭州市的川芎(统货)价格为14.4元公斤,走势加快,货源不丰。近期冻库晒货在14到14.5好货不好寻，想出的都出了，不出的价格不合适不出，去年冻库晒货在13.2到13.6，炕货在13块多"
安徽省亳州市谯城区白术整体价格稳定,2025-12-24 10:00,白术,"【天地网讯】

安徽省亳州市谯城区白术最新行情：一年白术牙统货10-13元，选货16元，一年白术牙价格稳定，好货少；二年白术统货价格22-25元，好选货33元，二年白术好货少，走动加快，好货难求。（本信息由安徽省亳州市谯城区白术商家 李亚东 19305677779 提供）"
地黄鲜货今年产量明显减产,2025-12-24 09:56,地黄,"【天地网讯】

今日行情，河南省焦作市武陟县，地黄（陈货一级）价格为17元/公斤，（陈货二级）价格为14.5元/公斤，（陈货三级）价格为11.5元/公斤，（新货一级）价格为16元/公斤，（新货二级）价格为14元/公斤，（新货三级）价格为11元/公斤，走势畅快，货源正常。
（本信息由产地代购代销商家葛冬彬15893003106提供）"
甘肃省定西市岷县当归城2025年12月24日当归价趋于稳定,2025-12-24 09:52,当归,"【天地网讯】

甘肃省定西市岷县当归城2025年12月24日，当归价趋于稳定，走货一般，目前中国当归城当归价格：个子80-100头价格32元左右，60-80头价格35-42元，40-60头价格45-58元，20-10头价格62元，5-10头65元，当归机切片：保农残55-60元左右，含农残37-52元，一棵树切片55元左右。当归股片：保农残从小到大22-65元，当归机切头片毛头片90-100元（不过筛），过筛1cm115元上下，去皮选装170-180元，出口标准箱归一条龙（一等，特等，十支归，五支归）价90一98元，鲜当归产新已结束了。以上信息仅供参考。（本信息由 中药材天地网岷县站 杨俊民 13993205558 提供）"
云南省楚雄彝族自治州楚雄市茯苓行情比较稳定,2025-12-24 08:14,茯苓,"【天地网讯】

云南省楚雄市双柏县茯苓近段时间行情比较稳定，现一刀丁价格在17-18元之间，中心丁23.5元左右，乱坨10.5元上下，今年当地的产量不大。（信息来源云南乐融中药材种植有限公司张女士18808780226）"
十二月二十三日河北半夏资讯,2025-12-23 18:28,半夏,"【天地网讯】

今日行情，河北省保定市安国市的半夏供应充足，0.6以上统货上市量平稳，价格39-42元之间不等，0.8以上统货43-45元之间不等，0.6以下米珠 23-25元之间不等，6-8货33-35元之间不等。"
河北省保定市安国药市半夏走势缓慢,2025-12-23 17:56,半夏,"【天地网讯】

今日行情，河北省保定市安国药市半夏（0.6）价格为40元/左右，（0.6到0.8）价格为35元/左右，（0.6）价格为23元/左右，走势缓慢，货源充足，且该品上市量大，但交易量不大。"
江西省宜春市高安市金樱子走势稳定,2025-12-23 16:20,金樱子,"【天地网讯】

今日行情，江西省宜春市高安市金樱子供应有量，目前价格稳定，（统）价格为11元左右， 金樱子中晚价格为9元一公斤，晚期价格为11元一公斤。"
2025年当季贵州新薏仁米收货基本上已到中尾期 价格平稳,2025-12-23 15:47,薏苡仁,"【天地网讯】

2025年再过几天就结束了，我们将迎来新年2026年，2025年当季贵州新薏仁米收货基本上已到中尾期，因现在进入12月底，目前薏苡仁替代种植指标已经没有了，所以进不了中国，现价格一直比较平稳，目前价格是这几年价格比较便宜的一年，谷子也是历年的低价，现贵州95米出厂价9.8元/公斤，黑壳95米7.6元/公斤，以上不含税含运费，98米每吨上浮500元/吨。（贵州省俊之家薏苡科技有限公司 张先生 13906659028）"
山东省泰安市新泰市 白薇 走势畅快,2025-12-23 15:44,白薇,"【天地网讯】

今日行情，山东省泰安市新泰市，白薇（机选）价格为25元/公斤，走势畅快，货源充足。"
四川省眉山市彭山区川芎行情保持平稳,2025-12-23 15:35,川芎,"【天地网讯】

川芎，产地货源走动正常，现在一般常温炕货13.6元左右，冻库里优质晒货14.2元左右，阴干冻库晒货15.8元左右。（本信息由四川省眉山市彭山区商家盛万洪 13404063918 提供）"
四川省眉山市彭山区泽泻距离产新不远,2025-12-23 15:34,泽泻,"【天地网讯】

泽泻，月底开始产新了，由于库存有量，加上新货马上要上市了，现在常温库泽泻12.2元左右，陈货11.8元左右，冻库里优质晒货13.5元左右。（本信息由四川省眉山市彭山区商家谢东 15882086908 提供）"
江西省吉安市遂川县金樱子仍在产新,2025-12-23 14:04,金樱子,"【天地网讯】

江西省吉安市遂川县金樱子目前仍在产新之中，采收已经到了后期，现产地鲜货价格在4.5元上下，干货10元左右，走动一般。（信息由江西省吉安市遂川县商家胡先生13979630695提供）"
江西省九江市都昌县栀子近期价格稳定,2025-12-23 14:03,栀子,"【天地网讯】

江西省九江市都昌县栀子产新已经结束，现产地货源供应还有量，近期走动一般，行情在近来稳定运行，现色选货价格在25元左右，一般货20元上下。（信息由江西省九江市都昌县商家石先生提供）"
广东省湛江市遂溪县香附产新价低,2025-12-23 13:58,香附,"【天地网讯】

广东省湛江市遂溪县香附正值产新之中，今年的产量较好，但是由于市场今年消化情况一般，行情回落，目前产地刚烧出来七成干的新货价格在3.6-3.7元之间，抛光干燥后价格在5.5-5.6元，有商订货但价低种植的采挖积极性一般。（信息由广东省湛江市遂溪县商家陈先生13902573995提供）"
广东省湛江市遂溪县穿心莲行情继续在偏低位运行,2025-12-23 13:57,穿心莲,"【天地网讯】

广东省湛江市遂溪县穿心莲目前货源充足，近期商家购货量少，行情继续在偏低位运行，现统货价格在4.5-5元之间，持货商多亏本。（信息由广东省湛江市遂溪县商家陈先生13902573995提供）"
广东省湛江市遂溪县广藿香货源走动一般,2025-12-23 13:56,广藿香,"【天地网讯】

广东省湛江市遂溪县广藿香近期产新持续，产地货源充足，商家正常采购，货源走动一般，行情平淡运行，现产地收购价在4.8-5元之间，售出价6-6.5元。（信息由广东省湛江市遂溪县商家陈先生13902573995提供）"
广东省湛江市高良姜行情走平,2025-12-23 13:56,高良姜,"【天地网讯】

广东省湛江市遂溪县高良姜货源供应稳定，近期由于调料市场需求减弱，产地货源走动也较慢，行情在近期走平，现含硫货价格在12.5元左右，无硫货14.5元上下。（信息由广东省湛江市遂溪县商家陈先生13902573995提供）"
广东省湛江市遂溪县布渣叶行情没有变化,2025-12-23 13:55,布渣叶,"【天地网讯】

广东省湛江市遂溪县布渣叶货源供应有量，近期货源走动不快，行情相比前期没有变化，现统货价格在8.5元左右。（信息由广东省湛江市遂溪县商家陈先生13902573995提供）"
广东省湛江市遂溪县金沙牛货源不多行情继续在高位运行,2025-12-23 13:54,金沙牛,"【天地网讯】

广东省湛江市遂溪县金沙牛货源产出量一直不多，量小销势良好，近期行情继续在高位运行，现商家交给公司的价格在8600-8800元之间。（信息由广东省湛江市遂溪县商家陈先生13902573995提供）"
江西省樟树市栀子产新结束近期价稳,2025-12-23 13:53,栀子,"【天地网讯】

江西省樟树市栀子产新已经结束了，近期当地货源陆陆续续走出，价格暂时保持稳定运行，现一般统货价格在18元左右，色选货23元上下。（信息由江西省樟树市商家龚先生13607956411提供）"
河北省保定市安国市瓜蒌走动平稳,2025-12-23 13:43,瓜蒌,"【天地网讯】

河北省保定市安国市瓜蒌走动平稳，行情稳定，产地货源足，统货价格在25元左右。（本信息由河北省保定市安国市刘先生18631218941提供）"
安徽亳州五马集镇牡丹皮行情平稳,2025-12-23 13:24,牡丹皮,"【天地网讯】

牡丹皮，今年新货产量减少，但受大环境影响，商家对其关注度一般，行情平稳，当前五马集镇与其周边新货刮丹要价在90元以上100元左右（含潮），陈货刮丹皮因质量不等售价在60-100元以上。（本信息由安徽亳州五马集镇孙老板15056770014提供）"
安徽亳州五马集镇牡丹皮黑丹价格暂无明显变化,2025-12-23 13:23,牡丹皮,"【天地网讯】

黑丹皮，最近走动平稳，价格暂无明显变化，当前五马集镇与其周边能开片的小统新货售价在42-43元，陈货能开片的小统售价在40元左右，药厂货报价在35元左右。（本信息由安徽亳州五马集镇孙老板15056770014提供）"
安徽亳州十九里集镇知母行情平稳,2025-12-23 13:12,知母,"【天地网讯】

地产知母少量采挖，鲜货个子价格在2元左右，而切片销售还是以库存为主，行情平稳，十九里集镇与集镇周边长片药厂货售价在7-8元左右，饮片货报价在10-12元之间不等。（本信息由安徽亳州十九里集镇商家杜井峰13605688580提供）"
安徽亳州十九里集镇紫菀行情依然平稳,2025-12-23 13:10,紫菀,"【天地网讯】

地产紫菀少量采挖，近两集行情依然平稳，切好的片子一般价格在12-13元，切好的片子包检货价格在15-20元之间不等，而个子报价在7-10元之间不等。（本信息由安徽亳州十九里集镇商家杜井峰13605688580提供）"
安徽亳州十九里集镇白芍行情暂时转稳,2025-12-23 13:09,白芍,"【天地网讯】

白芍产新基本结束，并由于短时价格明显回升，近两日行情暂时转稳，十九里集镇一二级的优质货售价在80-90元之间不等，一般一二级货报价在60-80元之间不等，三四级报价在50元左右；而尾芍行情上涨幅度不大，陈货报价在20元左右。（本信息由安徽亳州十九里集镇商家杜井峰13605688580提供）"
安徽亳州十九里集镇白芍饮片行情止升有所转稳,2025-12-23 13:08,白芍,"【天地网讯】

受阴雨天气影响，白芍今天十九里集镇未有上货，现加工好的1.2-1.8的饮片价格在120-130元之间不等，1.0-1.6的饮片价格在100元左右，加工好的4-12饮片报价在40元左右，且10天左右大片上涨10至10元以上，小片上涨5-10元以内，目前行情有所转稳。（本信息由安徽亳州十九里集镇商家杜井峰13605688580提供）"
