标题,发布时间,品种,内容
陕西省商洛市商南县野菊花走势稳定,2026-01-09 14:28,野菊花,"【天地网讯】

今日行情，陕西省商洛市商南县野菊花（90颗粒）价格为32元/公斤，80颗粒30元/公斤，走势稳定，货源供应尚且有量。以上资讯由陕西商南秦岭产地小吴中药材15877621038提供。"
陕西省商洛市商南县葛根价格回落,2026-01-09 14:25,葛根,"【天地网讯】

今日行情，陕西省商洛市商南县葛根正值产新期，价格回落，今年新货产出量很少，鲜葛根购销价八毛上下一单斤，药厂统片5元左右一公斤，货源走动平稳，产地库存越来越少，后市行情预估稳中有涨，以上资讯由陕西商南秦岭产地小吴中药材15877621038提供。"
广西桂林市灌阳县骨碎补行情转稳,2026-01-09 14:21,骨碎补,"【天地网讯】

广西桂林市灌阳县骨碎补前期价格走低，近来暂时转为稳定运行，现产地货源不多，走动不快，统货价格在43-45元之间。（信息由广西桂林市灌阳县商家唐先生13607839811提供）"
广西桂林市灌阳县菝葜行情表现平平,2026-01-09 14:21,菝葜,"【天地网讯】

广西桂林市灌阳县菝葜近期货源走动缓慢，行情表现平平，现统片价格在4-4.5元之间，产地库存有量。（信息由广西桂林市灌阳县商家唐先生13607839811提供）"
陕西省商洛市洛南县蝉蜕走势畅快,2026-01-09 14:21,蝉蜕,"【天地网讯】

今日行情，陕西省商洛市洛南县蝉蜕（半沙半泥货）价格为630元/公斤左右，走势畅快，货源见底，目前价格反弹回升，但到达农户心里预期价格，出货愿望强烈，库存逐渐见底，产地大货基本已出，但目前仍可以组织大货；其中壳蝉脱走动较慢，货源充足，价格在310元/公斤左右。"
广西桂林市灌阳县辣蓼草货丰价低,2026-01-09 14:20,辣蓼草,"【天地网讯】

广西桂林市灌阳县辣蓼草货源继续丰厚，近期走动变化不大，行情继续在偏低位徘徊，现统货在2.6-2.7元之间。（信息由广西桂林市灌阳县商家唐先生13607839811提供）"
河南省南阳市西峡县猪苓行情平稳,2026-01-09 18:01,猪苓,"【天地网讯】

河南省南阳市西峡县猪苓年前采挖基本结束，目前走动正常，行情平稳，现产地统货因质量不等、售价稍有悬殊，价格在95-100元之间，大统货价格在110-120元之间不等。（本信息由河南省西峡县太平镇马健翔15038795135提供）"
河南省南阳市西峡县连翘行情基本稳定,2026-01-09 18:00,连翘,"【天地网讯】

河南省南阳市西峡县连翘走动平稳，行情基本稳定，现产地青翘一般货售价在35-40元之间不等，而挥发油合格的货售价在43-45元之间不等。（本信息由河南省西峡县太平镇马健翔15038795135提供）"
河南信阳产地目前蜈蚣走货畅快,2026-01-09 17:09,蜈蚣,"【天地网讯】

河南信阳产地目前蜈蚣走货畅快，行情基本平稳，产地货源一般，16公分3.1元每条，15公分2.9元每条，14公分2.5元每条，13公分的2.2元每条，12公分的1.2元每条，小条统货0..7元每条，后市关注。（ 该信息由河南信阳产地商家张广友13937681769提供）"
河南信阳产地近期野菊花走货顺畅,2026-01-09 17:07,野菊花,"【天地网讯】

河南信阳产地近期野菊花走货顺畅，价格上浮，该品种今年减产严重，产地好货较少，目前一级货48元每公斤，90货38-40每公斤，药厂货33-35元每公斤，后市持续关注。（ 该信息由河南信阳产地商家张广友13937681769提供）"
甘肃张掖市民乐县产地近期板蓝根走货平稳,2026-01-09 16:51,板蓝根,"【天地网讯】

甘肃张掖市民乐县产地近期板蓝根走货平稳，近期产地持货者出售意愿较强，客商对产地货源关注度较高，但市场整体走动速度偏慢。目前市场保有量巨大，库存量较为庞大，终端市场需求表现薄弱，消化量有限，受此影响，板蓝根价格短期内上涨难度较大，行情或持续平稳运行。目前甘肃药厂货价格在9.5-10元/公斤，饮片货价格为10.5-11元/公斤；东北货价格8.6-8.8元/公斤，新疆货价格8.5-9.2元/公斤。（该信息由甘肃民乐县诚泰药业有限公司韩祖德 13830692270提供）"
河南焦作温县产地山药价格上涨,2026-01-09 16:49,山药,"【天地网讯】

河南焦作温县产地山药价格上涨，目前山药水洗货价格为6-6.5元每公斤，净条12-14元 每公斤，光条片0.7—1.2 的价格为18-19元每公斤， 1.2—1.5的货价格为22-23元每公斤，1.5-2.0的价格为33-35元每公斤，1.8—2.5的价格为43-45元每公斤， 后市持续关注。（ 该信息由河南焦作温县晟恒中药材有限公司15539148381提供）"
河南焦作武陟县地黄价格稳定,2026-01-09 16:46,地黄,"【天地网讯】

河南焦作温县地黄价格稳定，鲜货产新基本结束，走货平稳，地黄大统货9.5-10元每公斤，大三级个子价格为10.5—10.7元每公斤，二级个子价格为13.8—14元每公斤， 后市持续关注。（ 该信息由河南焦作温县晟恒中药材有限公司15539148381提供）"
安徽产地桔梗持续产新中，走货一般,2026-01-09 16:33,桔梗,"【天地网讯】

安徽产地近期桔梗近期走货迟缓，行情保持平稳运行，产地货源还可以，目前内蒙产区产新基本结束，走货一般，甘肃产区目前正值产新，产地产地正在加工中， 甘肃新货还未大量上市，安徽产区近期持续产新， 统货价格为为30元每公斤。目前内蒙带皮桔梗报价为10元左右每公斤，刮皮货为18~20元每公斤，其他产区陆续批量上市。除内蒙古外，安徽、陕西、甘肃等地货源依旧紧俏，后市值得持续关注。（该信息由安徽恩禾中药材有限公司 谢陆宇 13655650117提供）"
湖南产地龙牙百合近期走货畅快,2026-01-09 16:24,百合,"【天地网讯】

湖南产地龙牙百合近期走货畅快，关注人气较高，价格平稳运行，产地货源还可以，精选特级价格为135-145元每公斤，精选二级价格为130-135元每公斤，精选三级价格为118-130元每公斤，中三王115-120元每公斤，小三王95-105元每公斤，后市持续关注。（ 该信息由湖南宏裕升百合袁女士13874222987提供）"
河南焦作武陟县山药走货一般,2026-01-09 16:20,山药,"【天地网讯】

河南焦作武陟县山药近期走货一般， 价格稳定运行，产地有货源充足，山药圆片0.8-1.2的价格为22元每公斤， 1.5-1.8的价格为38元每公斤。（该信息由河南武陟润鑫种植专业合作社柴顺营13598511115提供）"
