标题,发布时间,品种,内容
安徽产地桔梗持续产新，价格如预期触底起稳,2025-12-23 12:08,桔梗,"【天地网讯】

安徽产地近期桔梗持续产新中，价格如预期触底起稳。商家关注度有所增加，产地正在进行鲜货加工中，目前，内蒙产区鲜货基本结束，干货上货量有所减少。价格保持不变，目前内蒙带皮桔梗报价为10元左右每公斤，刮皮货为18~20元/公斤。甘肃货现已经产新，加工户正在积极加工中，鲜货价格从最初的4.4每公斤，持续上涨到5.6每公斤，高价的冲击再加上甘肃产区部分收购商掺杂一些外地品种的原因，致使加工甘肃货的加工户们热度稍减，现甘肃鲜货回落到每公斤5元。比起内蒙货的跌幅程度，甘肃品种的价格还是比较稳定。相对而言，现在的价格，或许是个入手内蒙货的好时机。种植户全部陷入严重亏损，虽说一年半载价格可能不会上涨，但是掉价的几率更是微乎其微，预估计明年秋后内蒙桔梗价格会稍有回暖。但想要回到每公斤25元左右的价格，估计还要3-5年的时间沉淀，后市值得持续关注。（该信息由安徽恩禾中药材有限公司 谢陆宇 13655650117提供）"
甘肃省张掖市民乐县王不留行走货正常,2025-12-23 12:02,王不留行,"【天地网讯】

甘肃省张掖市民乐县王不留行走货正常，价格稳定运行， 精选价格为5元每公斤，后市持续关注。（ 该信息由甘肃民乐县德正堂中药材种植专业合作社 韩军15379782810提供）"
甘肃省张掖市民乐县莱菔子走货一般,2025-12-23 12:01,莱菔子,"【天地网讯】

甘肃省张掖市民乐县产地莱菔子走货一般，价格平稳，精选货价格为9元每公斤，后市持续关注。（ 该信息由甘肃民乐县德正堂中药材种植专业合作社 韩军15379782810提供）"
甘肃张掖市民乐县板蓝根近期走货平稳,2025-12-23 11:57,板蓝根,"【天地网讯】

甘肃张掖市民乐县板蓝根近期走货平稳，价格平稳，目前药厂统货价格为9.5元每公斤， 精选节子货价格为17元每公斤， 后市持续关注产新情况。（ 该信息由甘肃民乐县德正堂中药材种植专业合作社 韩军15379782810提供）"
甘肃张掖民乐县大青叶走货一般,2025-12-23 11:55,大青叶,"【天地网讯】

甘肃张掖民乐县大青叶走货一般，价格平稳运行，产地货源充足，药厂统货价格为2.5-3元每公斤， 后市持续关注。（ 该信息由甘肃民乐县德正堂中药材种植专业合作社 韩军15379782810提供）"
山东省临沂市平邑县丹参走势稳定,2025-12-23 11:25,丹参,"【天地网讯】

山东省临沂市平邑县丹参供应有量，目前走势稳定，现产地打粉颗粒9元左右，异性片11元，统货价格为10元左右，0.3号筛-0.5号筛各类规格丹参片（色选片） 精品价格为14元左右，打粉小条16.5元左右。"
山东省临沂市平邑县 山楂货源供应稳定,2025-12-23 11:21,山楂,"【天地网讯】

山楂投料价格为5元左右，饮片级晒货6元左右，统货5元左右， 饮片烘干有籽货7块左右，山楂碎肉7元左右，花茶专用片7.5左右，地炕6.5元左右，饮片烘干无籽货16元左右，优质中心，山楂碎肉6.5-9元左右，联系电话15092989988"
湖北宜昌宜都市陈皮价格下滑,2025-12-23 11:19,陈皮,"【天地网讯】

湖北宜昌宜都市陈皮价格下滑，走动还可以 ，湖北宜都市柑桔今年是大年，果多销售有限，农户没卖完的桔子只有剥皮售卖，陈皮产量大于去年，但今年后期天气一直晴好，陈皮晒的都比较干，质量是近几年来最好的一年，价格也不高，现挑选好货6.5元/公斤左右，统货5.5元/公斤左右，二黄皮4元/公斤左右，精选陈皮丝7.5元/公斤左右，后期价格会根据出货情况会有所变化，值得持续关注。(信息由宜都市陈皮商家信息站张家清 15872651591报道）"
山东省临沂市平邑县 山楂行情平稳,2025-12-23 11:18,山楂,"【天地网讯】

山东省临沂市平邑县山楂投料价格为5元左右，饮片级晒货6元左右，统货5元左右， 饮片烘干有籽货7元左右，山楂碎肉7元左右，花茶专用片7.5元左右，地炕6.5元左右，饮片烘干无籽货16元左右，优质中心，山楂碎肉6.5-9元左右，联系电话15092989988"
陝西汉中产地近期川乌价格下滑,2025-12-23 11:07,川乌,"【天地网讯】

陝西汉中产地近期川乌价格下滑， 走货平稳， 产地货源一般，价格45元左右。（ 该信息由陕西产地商家李长军13891608032提供）"
陕西产地近期天葵子走货一般,2025-12-23 11:06,天葵子,"【天地网讯】

陕西产地近期天葵子走动一般， 产地货源还可以， 价格平稳运行，合格货价格75元每公斤左右。（ 该信息由陕西产地商家李长军13891608032提供）"
甘肃省定西市辖区近日甘草走货稍快,2025-12-23 10:49,甘草,"【天地网讯】

甘肃省定西市辖区近日甘草走货稍快，价格基本稳定，甘草含量、片型及颜色造成价格差别较大，甘草0.3~0.5筛丁4~9元/公斤，0.5~0.8筛的甘草片9~13元/公斤，0.8~1.2筛的甘草片14~24元/公斤，1.2~1.5筛圆片15~25元/公斤。（该信息由甘肃陇西县产地马强15255976662提供）"
甘肃省定西市黄芪近期成交量有所增加,2025-12-23 10:47,黄芪,"【天地网讯】

甘肃省定西市辖区黄芪近期成交量有所增加，价格稳定，黄芪0.3~0.5丁8~9.5元/公斤，0.5~0.8圆片12~13.5元/公斤，0.8~1.2圆片28~32元/公斤，指甲片0.4~0.6的12~15元/公斤，0.6~0.8的18~21元/公斤，0.8~1.0的33~38元/公斤，1.0~1.2的48~54元/公斤，1.2~1.5的55~60元/公斤。（该信息由甘肃陇西县产地马强15255976662提供）"
甘肃省定西市近日当归成交量一般,2025-12-23 10:46,当归,"【天地网讯】

甘肃省定西市近日当归成交量一般，外地客商较少走货缓慢，主要以本地商贩和加工户为主，药厂货31~37元/公斤，小条38~45元/公斤，中条46~50元/公斤，大条51~58元/公斤，特大条60元以上。（该信息由甘肃陇西县产地马强15255976662提供）"
甘肃省定西今年甘肃鲜党参全面结束,2025-12-23 10:45,党参,"【天地网讯】

甘肃省定西今年甘肃鲜党参全面结束，党参原装个子及饮片趋于稳定，药厂条货大约35元/公斤，今日小中条36~42元/公斤，(0.4筛段)价格70~80元/公斤，（0.3筛段）价格45~55元/公斤，(0.4筛片)价格大约为70~85元/公斤，(0.3筛片)55~65元/公斤，由于新货加工的品质不一，造成价格差別较大，随着干货上市量的变化，党参价格还会波动变化。（该信息由甘肃陇西县产地马强15255976662提供）"
宁夏中卫市海原县小茴香走动平稳,2025-12-23 10:15,小茴香,"【天地网讯】

宁夏中卫市海原县小茴香走动平稳，行情稳定，产地货源有量，2025年11月送检产品各指标准均符合2025版药典规定，其中挥发油指标检出含量2.3%（>=1.5药典规定），反式茴香脑指标检出含量2.9%（>=1.4药典规定）均明显高于药典规定含量，产品无黄曲霉素、重金属检出，除虫农药检出量远低于药典规定，真正打造绿色无污染高品质产品，欢迎有需要的客户洽谈。本地小茴香普货价格在每公斤11-14元之间。（本信息由宁夏中卫市海原县赵永国13519598889提供）"
安徽省阜阳市阜南县 夏天无 持续上涨,2025-12-23 10:10,夏天无,"【天地网讯】

今日行情，安徽省阜阳市阜南县，夏天无产地价格持续上涨，目前一般不够含量统货价46左右，够含量的60左右，因商家购货积极，价格短期内可能还会上行。（产地商家陈书玲：17754881336）"
陕西省汉中市城固县延胡索走动畅快,2025-12-23 09:07,延胡索,"【天地网讯】

陕西省汉中市城固县延胡索走动畅快，行情有所上扬，产地货源不多，统货价格在65元左右。（本信息由陕西省汉中市城固县梁刚15929420704提供）"
